{"basis_sha256":"0b0c2af06124379206d43c36a4c12fb456e3861dd335343f4382865a7aab6a05","category":"Based","contract_sha256":"2fbcdbcfa7ead20213143fecfff7a39ab5ef3b86214f54eaf67225f9cc2f5103","kind":"category-contract-rules","members_json":"{\"based.based-book.217e49bd\":{\"companions\":[],\"context_sha256\":\"06a68ae63ecee3b794fd67b32e0e638078da192fbe8a193ba2b7c25b9917e24b\",\"exceptions\":[{\"code\":\"E13\",\"evidence_sha256\":\"0773c9d40f40681b40293d51daaafe7568e6f9d413b8f567b94bf5babe6f3910\"}],\"presentation\":\"single\",\"record_sha256\":\"58ca79811fdd0d4baaaebd9c2ce25c005d6f2bf81eefba46c3bc64e0fe9f19b5\",\"source\":{\"path\":\"transparent.png\",\"sha256\":\"64a0a1d637ff0687ccbcaeca31b8e6b7235002b1ee8528e7a60be6a7d636f1fc\"},\"variant\":\"placeholder-single-efe4bc572a9ca105\"},\"based.based-comic.a8c42da9\":{\"companions\":[],\"context_sha256\":\"38ec60b4acb234d046931c1130209c5b7f4a63a97ed774892048e01b593e59f0\",\"exceptions\":[{\"code\":\"E08\",\"evidence_sha256\":\"0773c9d40f40681b40293d51daaafe7568e6f9d413b8f567b94bf5babe6f3910\"},{\"code\":\"E13\",\"evidence_sha256\":\"0773c9d40f40681b40293d51daaafe7568e6f9d413b8f567b94bf5babe6f3910\"}],\"presentation\":\"single\",\"record_sha256\":\"d2e474ee310028eafa4caabc972426afd9b63c271729a49938819704abb6cdc4\",\"source\":{\"path\":\"transparent.png\",\"sha256\":\"64a0a1d637ff0687ccbcaeca31b8e6b7235002b1ee8528e7a60be6a7d636f1fc\"},\"variant\":\"placeholder-single-efe4bc572a9ca105\"},\"based.based-true-story.b7922d94\":{\"companions\":[],\"context_sha256\":\"4ba50ecb60a9745b4d7ed167db2052167f5c2062fed37ae9592a2a2ec239528f\",\"exceptions\":[{\"code\":\"E08\",\"evidence_sha256\":\"0773c9d40f40681b40293d51daaafe7568e6f9d413b8f567b94bf5babe6f3910\"},{\"code\":\"E13\",\"evidence_sha256\":\"0773c9d40f40681b40293d51daaafe7568e6f9d413b8f567b94bf5babe6f3910\"}],\"presentation\":\"single\",\"record_sha256\":\"0da3c02ac182bf01b934400d7b79fb88b391232a27000cbf0dfbdc1509aea970\",\"source\":{\"path\":\"transparent.png\",\"sha256\":\"64a0a1d637ff0687ccbcaeca31b8e6b7235002b1ee8528e7a60be6a7d636f1fc\"},\"variant\":\"placeholder-single-efe4bc572a9ca105\"},\"based.based-video-game.6cbef0b1\":{\"companions\":[],\"context_sha256\":\"cb685deb28f8c1b840d0b1e6acec44e0cafa930d235c2a9f66a1b9930be2fb18\",\"exceptions\":[{\"code\":\"E08\",\"evidence_sha256\":\"0773c9d40f40681b40293d51daaafe7568e6f9d413b8f567b94bf5babe6f3910\"},{\"code\":\"E13\",\"evidence_sha256\":\"0773c9d40f40681b40293d51daaafe7568e6f9d413b8f567b94bf5babe6f3910\"}],\"presentation\":\"single\",\"record_sha256\":\"dc77a73e9d2ebec078e38428edbce7593a34989e5a0fcfa0a0aaceb05aa52e89\",\"source\":{\"path\":\"transparent.png\",\"sha256\":\"64a0a1d637ff0687ccbcaeca31b8e6b7235002b1ee8528e7a60be6a7d636f1fc\"},\"variant\":\"placeholder-single-efe4bc572a9ca105\"}}","provenance_json":"{\"architecture_sha256\":\"1ef85874057d76fd60db65f685de779e1bb338dcc3632127746a17bd69d2afb6\",\"baseline_registry\":\"0b0c2af06124379206d43c36a4c12fb456e3861dd335343f4382865a7aab6a05\",\"baseline_source\":\"e611076e23cab31efa578ee92f1514bc993e9f93\",\"compiler_version\":1,\"exceptions_sha256\":\"0773c9d40f40681b40293d51daaafe7568e6f9d413b8f567b94bf5babe6f3910\",\"matrix_sha256\":\"eb2fce0d053f2362bec3a60b39a45ff6aabb422c8a5536e9cd5e8213504da042\"}","rules_json":"{\"placeholder-single-efe4bc572a9ca105\":{\"caption_types_json\":\"{\\\"caption-2e838d4642919e9ffc89\\\":{\\\"definition_json\\\":\\\"{\\\\\\\"case\\\\\\\":\\\\\\\"upper\\\\\\\",\\\\\\\"direction\\\\\\\":\\\\\\\"auto\\\\\\\",\\\\\\\"fallback\\\\\\\":null,\\\\\\\"key\\\\\\\":\\\\\\\"key_names.BASED_ON_A_BOOK\\\\\\\",\\\\\\\"mode\\\\\\\":\\\\\\\"translation\\\\\\\",\\\\\\\"template_key\\\\\\\":null,\\\\\\\"text\\\\\\\":\\\\\\\"\\\\\\\"}\\\",\\\"text\\\":\\\"BASED ON A BOOK\\\",\\\"translation_json\\\":\\\"{\\\\\\\"fingerprint\\\\\\\":\\\\\\\"195945a08bf82e7816b7362528d93974885feb2fbe2217cf170c1a646de1d0c1\\\\\\\",\\\\\\\"mode\\\\\\\":\\\\\\\"translation\\\\\\\",\\\\\\\"trace\\\\\\\":[{\\\\\\\"key\\\\\\\":\\\\\\\"key_names.BASED_ON_A_BOOK\\\\\\\",\\\\\\\"language\\\\\\\":\\\\\\\"en\\\\\\\",\\\\\\\"source_sha256\\\\\\\":\\\\\\\"5fe987030981e83c35fab37192240afd596febf7f6f4d205a9c024a272ff390f\\\\\\\",\\\\\\\"value_sha256\\\\\\\":\\\\\\\"a3d985b0a850a46ea66c20a6ea79a7818a1400ddb98a68e54caf083a61b4a949\\\\\\\"}]}\\\"},\\\"caption-8a848c0c8382bb44a56b\\\":{\\\"definition_json\\\":\\\"{\\\\\\\"case\\\\\\\":\\\\\\\"upper\\\\\\\",\\\\\\\"direction\\\\\\\":\\\\\\\"auto\\\\\\\",\\\\\\\"fallback\\\\\\\":null,\\\\\\\"key\\\\\\\":\\\\\\\"key_names.BASED_ON_A_COMIC\\\\\\\",\\\\\\\"mode\\\\\\\":\\\\\\\"translation\\\\\\\",\\\\\\\"template_key\\\\\\\":null,\\\\\\\"text\\\\\\\":\\\\\\\"\\\\\\\"}\\\",\\\"text\\\":\\\"BASED ON A COMIC\\\",\\\"translation_json\\\":\\\"{\\\\\\\"fingerprint\\\\\\\":\\\\\\\"a3529d006517138cfc2311cc8a787a1673d07d126cd2ffa7a6aed3376c7fd8fc\\\\\\\",\\\\\\\"mode\\\\\\\":\\\\\\\"translation\\\\\\\",\\\\\\\"trace\\\\\\\":[{\\\\\\\"key\\\\\\\":\\\\\\\"key_names.BASED_ON_A_COMIC\\\\\\\",\\\\\\\"language\\\\\\\":\\\\\\\"en\\\\\\\",\\\\\\\"source_sha256\\\\\\\":\\\\\\\"5fe987030981e83c35fab37192240afd596febf7f6f4d205a9c024a272ff390f\\\\\\\",\\\\\\\"value_sha256\\\\\\\":\\\\\\\"92f3f1ffabc237326b7e8f03c1d626a1cf9341f73219c5a69d3fc5a5aa906a5d\\\\\\\"}]}\\\"},\\\"caption-c4460a06a2ed5ff77aed\\\":{\\\"definition_json\\\":\\\"{\\\\\\\"case\\\\\\\":\\\\\\\"upper\\\\\\\",\\\\\\\"direction\\\\\\\":\\\\\\\"auto\\\\\\\",\\\\\\\"fallback\\\\\\\":null,\\\\\\\"key\\\\\\\":\\\\\\\"key_names.BASED_ON_A_VIDEO_GAME\\\\\\\",\\\\\\\"mode\\\\\\\":\\\\\\\"translation\\\\\\\",\\\\\\\"template_key\\\\\\\":null,\\\\\\\"text\\\\\\\":\\\\\\\"\\\\\\\"}\\\",\\\"text\\\":\\\"BASED ON A VIDEO GAME\\\",\\\"translation_json\\\":\\\"{\\\\\\\"fingerprint\\\\\\\":\\\\\\\"d3ec928c44b8a9c992f3ebdb57e927d10e5960cf7e437696c5c73868d6255eaa\\\\\\\",\\\\\\\"mode\\\\\\\":\\\\\\\"translation\\\\\\\",\\\\\\\"trace\\\\\\\":[{\\\\\\\"key\\\\\\\":\\\\\\\"key_names.BASED_ON_A_VIDEO_GAME\\\\\\\",\\\\\\\"language\\\\\\\":\\\\\\\"en\\\\\\\",\\\\\\\"source_sha256\\\\\\\":\\\\\\\"5fe987030981e83c35fab37192240afd596febf7f6f4d205a9c024a272ff390f\\\\\\\",\\\\\\\"value_sha256\\\\\\\":\\\\\\\"4beba7ba0d8bf7990e58f82cb60629ce47b1c664d0a21a81606ca6b69a751020\\\\\\\"}]}\\\"},\\\"caption-ec174f3bacdd68b338fc\\\":{\\\"definition_json\\\":\\\"{\\\\\\\"case\\\\\\\":\\\\\\\"upper\\\\\\\",\\\\\\\"direction\\\\\\\":\\\\\\\"auto\\\\\\\",\\\\\\\"fallback\\\\\\\":null,\\\\\\\"key\\\\\\\":\\\\\\\"key_names.BASED_ON_A_TRUE_STORY\\\\\\\",\\\\\\\"mode\\\\\\\":\\\\\\\"translation\\\\\\\",\\\\\\\"template_key\\\\\\\":null,\\\\\\\"text\\\\\\\":\\\\\\\"\\\\\\\"}\\\",\\\"text\\\":\\\"BASED ON A TRUE STORY\\\",\\\"translation_json\\\":\\\"{\\\\\\\"fingerprint\\\\\\\":\\\\\\\"16222f7bf4019e976e47908ff0f538789e72258e3cb3232515924d38e966d39c\\\\\\\",\\\\\\\"mode\\\\\\\":\\\\\\\"translation\\\\\\\",\\\\\\\"trace\\\\\\\":[{\\\\\\\"key\\\\\\\":\\\\\\\"key_names.BASED_ON_A_TRUE_STORY\\\\\\\",\\\\\\\"language\\\\\\\":\\\\\\\"en\\\\\\\",\\\\\\\"source_sha256\\\\\\\":\\\\\\\"5fe987030981e83c35fab37192240afd596febf7f6f4d205a9c024a272ff390f\\\\\\\",\\\\\\\"value_sha256\\\\\\\":\\\\\\\"e36d220600e24644d180f4141373543e7cf3fb61bf7d840c2e5c1ec0099b13f2\\\\\\\"}]}\\\"}}\",\"companion_variants\":[],\"design_sha256\":\"57bdcf68ee84dc4ddbc160a7f99736bab0a9844242526dd18ac2ccfa08b18a72\",\"layout_json\":\"{\\\"bounds\\\":{\\\"box\\\":[1800,1000],\\\"maximum\\\":250,\\\"minimum\\\":100},\\\"kind\\\":\\\"captured_fit\\\"}\",\"presentation\":\"single\",\"required_presentations\":[\"single\"],\"source_kind\":\"placeholder\",\"source_roots\":[\"transparent.png\"],\"style_json\":\"{\\\"avg_color\\\":false,\\\"avg_color_image\\\":null,\\\"border\\\":false,\\\"border_color\\\":\\\"#FFFFFF\\\",\\\"border_width\\\":15,\\\"clean\\\":true,\\\"dom_color\\\":false,\\\"dom_color_image\\\":null,\\\"font\\\":\\\"fonts/Comfortaa-Medium.ttf\\\",\\\"font_color\\\":\\\"#FFFFFF\\\",\\\"font_size\\\":250,\\\"gradient\\\":1,\\\"logo_offset\\\":0,\\\"logo_resize\\\":2000,\\\"text_offset\\\":0,\\\"white_wash\\\":true}\",\"treatment\":\"NOT_APPLICABLE\"}}","schema_version":1,"version":"1.0.0"}