{"basis_sha256":"0b0c2af06124379206d43c36a4c12fb456e3861dd335343f4382865a7aab6a05","category":"Aspect","contract_sha256":"fc14d583c50d28e4f616c2aa853acdfcebdf1a4a9626500912791a8e3baa2b08","kind":"category-contract-rules","members_json":"{\"aspect.aspect-1-33.f23e8bae\":{\"companions\":[],\"context_sha256\":\"2c2de546bdfe8c4336469316e575b24b3517c3b0a1d2bede03a0df4fdfb4d246\",\"exceptions\":[{\"code\":\"E13\",\"evidence_sha256\":\"0773c9d40f40681b40293d51daaafe7568e6f9d413b8f567b94bf5babe6f3910\"}],\"presentation\":\"single\",\"record_sha256\":\"d878a1310f8ae9a1d2f3510182b344385245fcea8d60321f2b9ca7baf72462d1\",\"source\":{\"path\":\"logos_aspect/1.33.png\",\"sha256\":\"709a48a155f7cc5c169bc32cd35e24f6a356fb4e6346c27c546056280641ec56\"},\"variant\":\"logo-single-b3ad77cb3133f479\"},\"aspect.aspect-1-65.f7d5b971\":{\"companions\":[],\"context_sha256\":\"135dbf5b36312b365b2fc22f75ce1975a9285c03449ede390ec2fc6d6f3d3a56\",\"exceptions\":[{\"code\":\"E13\",\"evidence_sha256\":\"0773c9d40f40681b40293d51daaafe7568e6f9d413b8f567b94bf5babe6f3910\"}],\"presentation\":\"single\",\"record_sha256\":\"e3f12caa55eeecbe84b15d21825e50e9506c35ed3dee93ab4c9052e7a05f86c8\",\"source\":{\"path\":\"logos_aspect/1.65.png\",\"sha256\":\"9b27efbb0e35228d049f959253a252a82779f0514169f27faae8ffd8e180057a\"},\"variant\":\"logo-single-b3ad77cb3133f479\"},\"aspect.aspect-1-66.63fbfc6c\":{\"companions\":[],\"context_sha256\":\"f07839d8b26d01a594a5d0abf8251f61351d13dacf8bcd11cc06a20e03c02fb5\",\"exceptions\":[{\"code\":\"E13\",\"evidence_sha256\":\"0773c9d40f40681b40293d51daaafe7568e6f9d413b8f567b94bf5babe6f3910\"}],\"presentation\":\"single\",\"record_sha256\":\"ff6de8675edbd2993d86465d5feca9baaef3c3baf65d6c9350b1d876a7b15625\",\"source\":{\"path\":\"logos_aspect/1.66.png\",\"sha256\":\"dc375d681108bec0779ccfcd1226777e7f34c7286feecb3709561c9b4f816c6e\"},\"variant\":\"logo-single-b3ad77cb3133f479\"},\"aspect.aspect-1-78.77cd3af1\":{\"companions\":[],\"context_sha256\":\"8a6442545bd9affb66a7701f73bb160fcae3767af4dde1474524f128caa4dc72\",\"exceptions\":[{\"code\":\"E13\",\"evidence_sha256\":\"0773c9d40f40681b40293d51daaafe7568e6f9d413b8f567b94bf5babe6f3910\"}],\"presentation\":\"single\",\"record_sha256\":\"770186bcd96a91143944797378c198d5791d0bc46dac9591917eecaf966aea0e\",\"source\":{\"path\":\"logos_aspect/1.78.png\",\"sha256\":\"836c458b6b2e503c168c28c30c214d4483c4cb81c460a3dbdaeb12abbd11dc1f\"},\"variant\":\"logo-single-b3ad77cb3133f479\"},\"aspect.aspect-1-85.6dc70aed\":{\"companions\":[],\"context_sha256\":\"5d9fd36a8ea9b3fac312471327cb65a6a97e482ed8be07202ac16a624c0debd6\",\"exceptions\":[{\"code\":\"E13\",\"evidence_sha256\":\"0773c9d40f40681b40293d51daaafe7568e6f9d413b8f567b94bf5babe6f3910\"}],\"presentation\":\"single\",\"record_sha256\":\"a20da54b56e42a801330cc2d788a888a318d523f2fc79377190400d521500299\",\"source\":{\"path\":\"logos_aspect/1.85.png\",\"sha256\":\"59aa28382bc599672fb490d459f17483831dba87de0030a592fb2f670905ba1b\"},\"variant\":\"logo-single-b3ad77cb3133f479\"},\"aspect.aspect-2-2.9daf5484\":{\"companions\":[],\"context_sha256\":\"40191a648359fdcca91cf2a326df0e67937a6bad81385b91187c437c5f495722\",\"exceptions\":[{\"code\":\"E13\",\"evidence_sha256\":\"0773c9d40f40681b40293d51daaafe7568e6f9d413b8f567b94bf5babe6f3910\"}],\"presentation\":\"single\",\"record_sha256\":\"d48c36b56c9b90283e4eba4fc3f56fec833842fc68bfeb635d4e23f5764488c7\",\"source\":{\"path\":\"logos_aspect/2.2.png\",\"sha256\":\"3ce03574a60e131750568065aa2ac321e477fd7d0a709bfa51912e62b6fb65eb\"},\"variant\":\"logo-single-b3ad77cb3133f479\"},\"aspect.aspect-2-35.2b7eda2b\":{\"companions\":[],\"context_sha256\":\"d458d1a85563bbd3b903f3cbed12074afb8503431c0ee5d2fa2865e72a25b309\",\"exceptions\":[{\"code\":\"E13\",\"evidence_sha256\":\"0773c9d40f40681b40293d51daaafe7568e6f9d413b8f567b94bf5babe6f3910\"}],\"presentation\":\"single\",\"record_sha256\":\"4f5cec200b67f7c7d88cb8126c36645da1e098fb24c883f382789e8f4e6226b5\",\"source\":{\"path\":\"logos_aspect/2.35.png\",\"sha256\":\"f36b0276febc412d01179bb715d455b9cb59872495338db192dfdb0d8ce84849\"},\"variant\":\"logo-single-b3ad77cb3133f479\"},\"aspect.aspect-2-77.d9c63a28\":{\"companions\":[],\"context_sha256\":\"3c0fbf709e528eceaf706071e46c7d2dd0d22edfe9a8c0f37b0f45a3a8e64adb\",\"exceptions\":[{\"code\":\"E13\",\"evidence_sha256\":\"0773c9d40f40681b40293d51daaafe7568e6f9d413b8f567b94bf5babe6f3910\"}],\"presentation\":\"single\",\"record_sha256\":\"2182e73f43f3128ce89cfd3d57b6eca88964ac25eaaae73741120a4a5e01c919\",\"source\":{\"path\":\"logos_aspect/2.77.png\",\"sha256\":\"99282f25b8dfe5c9b9b8de63f2ad118ad1006cbda3e9e2c67e33853bc41b59b7\"},\"variant\":\"logo-single-b3ad77cb3133f479\"},\"aspect.aspect-other.141aed4b\":{\"companions\":[],\"context_sha256\":\"5aa492ba9cb09f120ff8f8f7403d6fa7f5bac6234191233ce7cbb80fbc2cea94\",\"exceptions\":[{\"code\":\"E08\",\"evidence_sha256\":\"0773c9d40f40681b40293d51daaafe7568e6f9d413b8f567b94bf5babe6f3910\"},{\"code\":\"E13\",\"evidence_sha256\":\"0773c9d40f40681b40293d51daaafe7568e6f9d413b8f567b94bf5babe6f3910\"}],\"presentation\":\"single\",\"record_sha256\":\"48f7eac79df984026cfd864595c41037d8381c96b28343047e767d1b85090afd\",\"source\":{\"path\":\"transparent.png\",\"sha256\":\"64a0a1d637ff0687ccbcaeca31b8e6b7235002b1ee8528e7a60be6a7d636f1fc\"},\"variant\":\"placeholder-single-fa4978e71f7c453d\"}}","provenance_json":"{\"architecture_sha256\":\"1ef85874057d76fd60db65f685de779e1bb338dcc3632127746a17bd69d2afb6\",\"baseline_registry\":\"0b0c2af06124379206d43c36a4c12fb456e3861dd335343f4382865a7aab6a05\",\"baseline_source\":\"e611076e23cab31efa578ee92f1514bc993e9f93\",\"compiler_version\":1,\"exceptions_sha256\":\"0773c9d40f40681b40293d51daaafe7568e6f9d413b8f567b94bf5babe6f3910\",\"matrix_sha256\":\"eb2fce0d053f2362bec3a60b39a45ff6aabb422c8a5536e9cd5e8213504da042\"}","rules_json":"{\"logo-single-b3ad77cb3133f479\":{\"caption_types_json\":\"{\\\"caption-c2f2d63203f3476b8ad3\\\":{\\\"definition_json\\\":\\\"{\\\\\\\"case\\\\\\\":\\\\\\\"upper\\\\\\\",\\\\\\\"direction\\\\\\\":\\\\\\\"auto\\\\\\\",\\\\\\\"fallback\\\\\\\":null,\\\\\\\"key\\\\\\\":null,\\\\\\\"mode\\\\\\\":\\\\\\\"none\\\\\\\",\\\\\\\"template_key\\\\\\\":null,\\\\\\\"text\\\\\\\":\\\\\\\"\\\\\\\"}\\\",\\\"text\\\":\\\"\\\",\\\"translation_json\\\":\\\"{\\\\\\\"fingerprint\\\\\\\":\\\\\\\"6fc65a924da20ce5fdb67c9dfa5196abfea5498b5b75b9ca713fdccb84a8109d\\\\\\\",\\\\\\\"mode\\\\\\\":\\\\\\\"none\\\\\\\",\\\\\\\"trace\\\\\\\":[]}\\\"}}\",\"companion_variants\":[],\"design_sha256\":\"f85597405a5088d1f24b02027bac81e100043ca541ec376f8e88fe346023eea0\",\"layout_json\":\"{\\\"bounds\\\":{},\\\"kind\\\":\\\"fixed\\\"}\",\"presentation\":\"single\",\"required_presentations\":[\"single\"],\"source_kind\":\"logo\",\"source_roots\":[\"logos_aspect\"],\"style_json\":\"{\\\"avg_color\\\":false,\\\"avg_color_image\\\":null,\\\"border\\\":false,\\\"border_color\\\":\\\"#FFFFFF\\\",\\\"border_width\\\":15,\\\"clean\\\":true,\\\"dom_color\\\":false,\\\"dom_color_image\\\":null,\\\"font\\\":\\\"fonts/Comfortaa-Medium.ttf\\\",\\\"font_color\\\":\\\"#FFFFFF\\\",\\\"font_size\\\":250,\\\"gradient\\\":1,\\\"logo_offset\\\":0,\\\"logo_resize\\\":1800,\\\"text_offset\\\":0,\\\"white_wash\\\":true}\",\"treatment\":\"WHITE_ONLY\"},\"placeholder-single-fa4978e71f7c453d\":{\"caption_types_json\":\"{\\\"caption-19bce3b692e32c09bba0\\\":{\\\"definition_json\\\":\\\"{\\\\\\\"case\\\\\\\":\\\\\\\"upper\\\\\\\",\\\\\\\"direction\\\\\\\":\\\\\\\"auto\\\\\\\",\\\\\\\"fallback\\\\\\\":null,\\\\\\\"key\\\\\\\":\\\\\\\"collections.aspect_ratio_other.name\\\\\\\",\\\\\\\"mode\\\\\\\":\\\\\\\"translation\\\\\\\",\\\\\\\"template_key\\\\\\\":null,\\\\\\\"text\\\\\\\":\\\\\\\"\\\\\\\"}\\\",\\\"text\\\":\\\"OTHER ASPECT RATIOS\\\",\\\"translation_json\\\":\\\"{\\\\\\\"fingerprint\\\\\\\":\\\\\\\"b0460449b6870009f813faeeab5a08b7f5460e67147bdd171e4ca084a69b4bf3\\\\\\\",\\\\\\\"mode\\\\\\\":\\\\\\\"translation\\\\\\\",\\\\\\\"trace\\\\\\\":[{\\\\\\\"key\\\\\\\":\\\\\\\"collections.aspect_ratio_other.name\\\\\\\",\\\\\\\"language\\\\\\\":\\\\\\\"en\\\\\\\",\\\\\\\"source_sha256\\\\\\\":\\\\\\\"5fe987030981e83c35fab37192240afd596febf7f6f4d205a9c024a272ff390f\\\\\\\",\\\\\\\"value_sha256\\\\\\\":\\\\\\\"f5dfc3edc825ec151543791285297d7e0ae75ba7edb7ac71b89363087f566124\\\\\\\"}]}\\\"}}\",\"companion_variants\":[],\"design_sha256\":\"1e04959f67a11bf4efed54dec2ee7dcf60092b954462bde5663c76bf6770c33e\",\"layout_json\":\"{\\\"bounds\\\":{\\\"box\\\":[1800,1000],\\\"maximum\\\":250,\\\"minimum\\\":100},\\\"kind\\\":\\\"captured_fit\\\"}\",\"presentation\":\"single\",\"required_presentations\":[\"single\"],\"source_kind\":\"placeholder\",\"source_roots\":[\"transparent.png\"],\"style_json\":\"{\\\"avg_color\\\":false,\\\"avg_color_image\\\":null,\\\"border\\\":false,\\\"border_color\\\":\\\"#FFFFFF\\\",\\\"border_width\\\":15,\\\"clean\\\":true,\\\"dom_color\\\":false,\\\"dom_color_image\\\":null,\\\"font\\\":\\\"fonts/Comfortaa-Medium.ttf\\\",\\\"font_color\\\":\\\"#FFFFFF\\\",\\\"font_size\\\":250,\\\"gradient\\\":1,\\\"logo_offset\\\":0,\\\"logo_resize\\\":1600,\\\"text_offset\\\":0,\\\"white_wash\\\":true}\",\"treatment\":\"NOT_APPLICABLE\"}}","schema_version":1,"version":"1.0.0"}