{"basis_sha256":"0b0c2af06124379206d43c36a4c12fb456e3861dd335343f4382865a7aab6a05","category":"Playlist","contract_sha256":"5047d834ecd3f8e5a0ed76ae24760b6947ae6b83e95198ce602e1715e445016b","kind":"category-contract-rules","members_json":"{\"playlist.playlist-arrowverse-timeline-order.09b7e4b8\":{\"companions\":[],\"context_sha256\":\"f9f87bfc3dd74b429971dd129b8ce79fe5a1098ea65f0a7ea9be32aa506c54a2\",\"exceptions\":[{\"code\":\"E04\",\"evidence_sha256\":\"0773c9d40f40681b40293d51daaafe7568e6f9d413b8f567b94bf5babe6f3910\"},{\"code\":\"E13\",\"evidence_sha256\":\"0773c9d40f40681b40293d51daaafe7568e6f9d413b8f567b94bf5babe6f3910\"}],\"presentation\":\"single\",\"record_sha256\":\"2c10770a65976224bcd1216aa8564fd22147fdf80452f6e579d9e28b49f7a0a0\",\"source\":{\"path\":\"logos_playlist/Arrowverse.png\",\"sha256\":\"256787f4761e845b3a626ab2c23b943eb626ce0d006a98a92a16ded4fac01f8b\"},\"variant\":\"timeline-order\"},\"playlist.playlist-dc-animated-universe-timeline-order.66af9f87\":{\"companions\":[],\"context_sha256\":\"4de5cd7f06dcafee5ef90212f3fbdf8bc5f710e189545cdee34ac69f2bdc3dae\",\"exceptions\":[{\"code\":\"E04\",\"evidence_sha256\":\"0773c9d40f40681b40293d51daaafe7568e6f9d413b8f567b94bf5babe6f3910\"},{\"code\":\"E12\",\"evidence_sha256\":\"0773c9d40f40681b40293d51daaafe7568e6f9d413b8f567b94bf5babe6f3910\"},{\"code\":\"E13\",\"evidence_sha256\":\"0773c9d40f40681b40293d51daaafe7568e6f9d413b8f567b94bf5babe6f3910\"}],\"presentation\":\"single\",\"record_sha256\":\"99b744ff3cac180cd7e7f96702428b98b6501bbe2622ecde7211792ecd99b3fe\",\"source\":{\"path\":\"logos_playlist/dca.png\",\"sha256\":\"94fba21cefc046ea0a4c4d813a0f376f8a9d85e9ca8441e7fc8eee651f066132\"},\"variant\":\"timeline-order\"},\"playlist.playlist-dragon-ball-timeline-order.24c7063f\":{\"companions\":[],\"context_sha256\":\"f81ae76ba8c61bdcde70d928202f547ac54e03b24d178025bedb814c188974c6\",\"exceptions\":[{\"code\":\"E04\",\"evidence_sha256\":\"0773c9d40f40681b40293d51daaafe7568e6f9d413b8f567b94bf5babe6f3910\"},{\"code\":\"E12\",\"evidence_sha256\":\"0773c9d40f40681b40293d51daaafe7568e6f9d413b8f567b94bf5babe6f3910\"},{\"code\":\"E13\",\"evidence_sha256\":\"0773c9d40f40681b40293d51daaafe7568e6f9d413b8f567b94bf5babe6f3910\"}],\"presentation\":\"single\",\"record_sha256\":\"4fc18aae77e57ee164ed061d7c94b86ded25d06d8cc3ad9fd21592a5cc937943\",\"source\":{\"path\":\"logos_playlist/DragonBall.png\",\"sha256\":\"52f4b15178c1cce8e8c1aae9ba73e8683fa88123936b2487bd5d2b5cb0a8c799\"},\"variant\":\"timeline-order\"},\"playlist.playlist-marvel-cinematic-universe-timeline-order.d704757c\":{\"companions\":[],\"context_sha256\":\"4ed0d9ad65e484c6a388e2cff8051512f4d62ca96148a389815ff67786b58df3\",\"exceptions\":[{\"code\":\"E04\",\"evidence_sha256\":\"0773c9d40f40681b40293d51daaafe7568e6f9d413b8f567b94bf5babe6f3910\"},{\"code\":\"E13\",\"evidence_sha256\":\"0773c9d40f40681b40293d51daaafe7568e6f9d413b8f567b94bf5babe6f3910\"}],\"presentation\":\"single\",\"record_sha256\":\"a3932d3cdfec8d2be8b0d0bf86bcf6055f8ad1c1e009a29ebbffcd9a5498cd52\",\"source\":{\"path\":\"logos_playlist/Marvel Cinematic Universe.png\",\"sha256\":\"75b0a1f58deca7a02ab0ebf15997da40d7554d82aa643e647f2d8495af4e82e8\"},\"variant\":\"timeline-order\"},\"playlist.playlist-pok-mon-timeline-order.efe5925f\":{\"companions\":[],\"context_sha256\":\"17c7a822a975707f8bcf6f0be036d9aada0232a3cd36b495207808d72f4a77dc\",\"exceptions\":[{\"code\":\"E04\",\"evidence_sha256\":\"0773c9d40f40681b40293d51daaafe7568e6f9d413b8f567b94bf5babe6f3910\"},{\"code\":\"E12\",\"evidence_sha256\":\"0773c9d40f40681b40293d51daaafe7568e6f9d413b8f567b94bf5babe6f3910\"},{\"code\":\"E13\",\"evidence_sha256\":\"0773c9d40f40681b40293d51daaafe7568e6f9d413b8f567b94bf5babe6f3910\"}],\"presentation\":\"single\",\"record_sha256\":\"afd5ea2d86551e572ec277d965b0ce823fb487fb787a787f9fe33aa46fe2d4e8\",\"source\":{\"path\":\"logos_playlist/Pok\\u00e9mon.png\",\"sha256\":\"fc03b941138c112254d545e39be14d6c1f507a02c529b488a029ce1e420ecbde\"},\"variant\":\"timeline-order\"},\"playlist.playlist-star-trek-timeline-order.53320ead\":{\"companions\":[],\"context_sha256\":\"e7ac034ebf27be838a83260b25d07c3141c4dd181b7582f778421b6737a07086\",\"exceptions\":[{\"code\":\"E04\",\"evidence_sha256\":\"0773c9d40f40681b40293d51daaafe7568e6f9d413b8f567b94bf5babe6f3910\"},{\"code\":\"E13\",\"evidence_sha256\":\"0773c9d40f40681b40293d51daaafe7568e6f9d413b8f567b94bf5babe6f3910\"}],\"presentation\":\"single\",\"record_sha256\":\"348080b6e46bd7753e10dc56d845062c49947640f000413466447421c40be9e5\",\"source\":{\"path\":\"logos_playlist/Star Trek.png\",\"sha256\":\"8a84de6dc3c0e5a5d6002f136b1b7fa496de929cba3b8035b32c92da13b2f2df\"},\"variant\":\"timeline-order\"},\"playlist.playlist-star-wars-the-clone-wars-timeline-order.c6750e0c\":{\"companions\":[],\"context_sha256\":\"9f06941c701e66571bd096aaeecb6088caf40ddfce3257db7c42f2405d5edb6b\",\"exceptions\":[{\"code\":\"E04\",\"evidence_sha256\":\"0773c9d40f40681b40293d51daaafe7568e6f9d413b8f567b94bf5babe6f3910\"},{\"code\":\"E13\",\"evidence_sha256\":\"0773c9d40f40681b40293d51daaafe7568e6f9d413b8f567b94bf5babe6f3910\"}],\"presentation\":\"single\",\"record_sha256\":\"e38c17a0108a1777fea46039f6be4694e3a39f6a191a7aea707c24283a1608ba\",\"source\":{\"path\":\"logos_playlist/Star Wars The Clone Wars.png\",\"sha256\":\"10e14d9cf5fdc3f63d06dde6690a89a0a8ae216d004e87729a09bcb793a62ebe\"},\"variant\":\"timeline-order\"},\"playlist.playlist-star-wars-timeline-order.0af9472c\":{\"companions\":[],\"context_sha256\":\"5640bb7eac6c2a2bcf4faedf9cdbbd8e52922826aff00853f188f782388d90fc\",\"exceptions\":[{\"code\":\"E04\",\"evidence_sha256\":\"0773c9d40f40681b40293d51daaafe7568e6f9d413b8f567b94bf5babe6f3910\"},{\"code\":\"E13\",\"evidence_sha256\":\"0773c9d40f40681b40293d51daaafe7568e6f9d413b8f567b94bf5babe6f3910\"}],\"presentation\":\"single\",\"record_sha256\":\"fa363d6b4fa8a7b33455ca8f2a50da7c018f37b352d4758e70b449b45379d8c5\",\"source\":{\"path\":\"logos_playlist/Star Wars.png\",\"sha256\":\"ed6408d3e9134ef2c528e164ef204feb05148edc54f60abc98cbadfbd39d7cea\"},\"variant\":\"timeline-order\"},\"playlist.playlist-x-men-timeline-order.627ce505\":{\"companions\":[],\"context_sha256\":\"6a6e894c7e01b316e97524da6b626d49e165af41a0a5ce48c6f95750f4a08a98\",\"exceptions\":[{\"code\":\"E04\",\"evidence_sha256\":\"0773c9d40f40681b40293d51daaafe7568e6f9d413b8f567b94bf5babe6f3910\"},{\"code\":\"E12\",\"evidence_sha256\":\"0773c9d40f40681b40293d51daaafe7568e6f9d413b8f567b94bf5babe6f3910\"},{\"code\":\"E13\",\"evidence_sha256\":\"0773c9d40f40681b40293d51daaafe7568e6f9d413b8f567b94bf5babe6f3910\"}],\"presentation\":\"single\",\"record_sha256\":\"1c26eda71dc3564fb293672bfdc66289a731822c56cabd9ac7ad3fde3dbd8e39\",\"source\":{\"path\":\"logos_playlist/X-men.png\",\"sha256\":\"f57574eeefecafbb435ac45cd8b350e51cb8303a78a83f1cdb623e9a8d2191b4\"},\"variant\":\"timeline-order\"}}","provenance_json":"{\"architecture_sha256\":\"1ef85874057d76fd60db65f685de779e1bb338dcc3632127746a17bd69d2afb6\",\"baseline_registry\":\"0b0c2af06124379206d43c36a4c12fb456e3861dd335343f4382865a7aab6a05\",\"baseline_source\":\"e611076e23cab31efa578ee92f1514bc993e9f93\",\"compiler_version\":1,\"exceptions_sha256\":\"0773c9d40f40681b40293d51daaafe7568e6f9d413b8f567b94bf5babe6f3910\",\"matrix_sha256\":\"eb2fce0d053f2362bec3a60b39a45ff6aabb422c8a5536e9cd5e8213504da042\"}","rules_json":"{\"timeline-order\":{\"caption_types_json\":\"{\\\"timeline-order\\\":{\\\"definition_json\\\":\\\"{\\\\\\\"case\\\\\\\":\\\\\\\"upper\\\\\\\",\\\\\\\"direction\\\\\\\":\\\\\\\"auto\\\\\\\",\\\\\\\"fallback\\\\\\\":null,\\\\\\\"key\\\\\\\":\\\\\\\"key_names.TIMELINE_ORDER\\\\\\\",\\\\\\\"mode\\\\\\\":\\\\\\\"translation\\\\\\\",\\\\\\\"template_key\\\\\\\":null,\\\\\\\"text\\\\\\\":\\\\\\\"\\\\\\\"}\\\",\\\"text\\\":\\\"TIMELINE ORDER\\\",\\\"translation_json\\\":\\\"{\\\\\\\"fingerprint\\\\\\\":\\\\\\\"790c5e5d70230cc0034b9a2cb7757fb42251cd512cde9741608b2a94832fc0b5\\\\\\\",\\\\\\\"mode\\\\\\\":\\\\\\\"translation\\\\\\\",\\\\\\\"trace\\\\\\\":[{\\\\\\\"key\\\\\\\":\\\\\\\"key_names.TIMELINE_ORDER\\\\\\\",\\\\\\\"language\\\\\\\":\\\\\\\"en\\\\\\\",\\\\\\\"source_sha256\\\\\\\":\\\\\\\"5fe987030981e83c35fab37192240afd596febf7f6f4d205a9c024a272ff390f\\\\\\\",\\\\\\\"value_sha256\\\\\\\":\\\\\\\"b0b3b0c0130a31d2bc202968f503bba3fe29428ac1b5f2c278e3d2eb2bd205cc\\\\\\\"}]}\\\"}}\",\"companion_variants\":[],\"design_sha256\":\"c7b5f13bbf024b269dff68203dad4a786194929d9b80ab1ebbbb0ed87f215b2d\",\"layout_json\":\"{\\\"bounds\\\":{\\\"box\\\":[1600,1000],\\\"maximum\\\":154,\\\"minimum\\\":100},\\\"kind\\\":\\\"captured_fit\\\"}\",\"presentation\":\"single\",\"required_presentations\":[\"single\"],\"source_kind\":\"logo\",\"source_roots\":[\"logos_playlist\"],\"style_json\":\"{\\\"avg_color\\\":false,\\\"avg_color_image\\\":null,\\\"border\\\":false,\\\"border_color\\\":\\\"#FFFFFF\\\",\\\"border_width\\\":15,\\\"clean\\\":true,\\\"dom_color\\\":false,\\\"dom_color_image\\\":null,\\\"font\\\":\\\"fonts/BebasNeue-Regular.ttf\\\",\\\"font_color\\\":\\\"#FFFFFF\\\",\\\"font_size\\\":154,\\\"gradient\\\":1,\\\"logo_offset\\\":-200,\\\"logo_resize\\\":1600,\\\"text_offset\\\":450,\\\"white_wash\\\":true}\",\"treatment\":\"WHITE_ONLY\"}}","schema_version":1,"version":"1.0.0"}